{
  "case_id": "am-rev",
  "status": "rights-reviewed",
  "updated": "2026-06-13",
  "sources": [
    {
      "source_id": "am-rev-src-01-paine-common-sense",
      "title": "Common Sense",
      "short_title": "Common Sense",
      "voice": "Thomas Paine",
      "date": "1776",
      "phase": "revolutionary-break",
      "register": "political-pamphlet",
      "archive": "Project Gutenberg",
      "source_url": "https://www.gutenberg.org/ebooks/147",
      "citation": "Paine, Thomas. Common Sense. Philadelphia, 1776. Project Gutenberg EBook #147. https://www.gutenberg.org/ebooks/147",
      "rights_status": "public-domain",
      "rights_rationale": "Published 1776; author died 1809. Well outside any copyright term in any jurisdiction. Project Gutenberg hosts a clean plain-text edition under its standard public-domain release. No OCR required.",
      "git_tracking": "committed",
      "acquisition_instructions": "Download plain-text UTF-8 from https://www.gutenberg.org/cache/epub/147/pg147.txt. Strip Gutenberg header/footer boilerplate before storing. Save to expected_local_path.",
      "expected_local_path": "cases/am-rev/corpus/raw/am-rev-src-01-paine-common-sense.txt",
      "analytical_priority": "high",
      "risk_flags": [],
      "notes": "Core revolutionary-break document. High density of liberty/tyranny and founding-sacrifice metaphors. Essential for cross-case comparison with Lincoln covenant language."
    },
    {
      "source_id": "am-rev-src-02-jefferson-declaration",
      "title": "Declaration of Independence and Jefferson draft materials",
      "short_title": "Declaration of Independence",
      "voice": "Thomas Jefferson / Continental Congress",
      "date": "1776",
      "phase": "revolutionary-break",
      "register": "legal-political-proclamation",
      "archive": "National Archives / Founders Online",
      "source_url": "https://www.archives.gov/founding-docs/declaration-transcript",
      "citation": "Declaration of Independence, July 4, 1776. National Archives. https://www.archives.gov/founding-docs/declaration-transcript. Jefferson draft: Founders Online, National Archives, https://founders.archives.gov/",
      "rights_status": "public-domain",
      "rights_rationale": "U.S. federal government document, 1776. No copyright applies under any U.S. or international standard. Multiple authoritative clean-text sources available from National Archives and Founders Online.",
      "git_tracking": "committed",
      "acquisition_instructions": "Transcription text available directly from National Archives at https://www.archives.gov/founding-docs/declaration-transcript. Jefferson's rough draft and committee draft are at https://founders.archives.gov/documents/Jefferson/01-01-02-0176. Copy clean text; preserve section structure. Save final and draft versions as separate files if Jefferson draft is included.",
      "expected_local_path": "cases/am-rev/corpus/raw/am-rev-src-02-jefferson-declaration.txt",
      "analytical_priority": "high",
      "risk_flags": [],
      "notes": "Final Declaration plus Jefferson draft preferred for showing editorial suppression and substitution of sacrifice language. The draft's struck passages are analytically important for absence analysis."
    },
    {
      "source_id": "am-rev-src-03-washington-general-orders",
      "title": "Selected Washington General Orders and Circular Letters, 1775–1783",
      "short_title": "Washington General Orders",
      "voice": "George Washington",
      "date": "1775–1783",
      "phase": "wartime-sacrifice",
      "register": "military-orders",
      "archive": "Founders Online (National Archives)",
      "source_url": "https://founders.archives.gov/",
      "citation": "Washington, George. General Orders and Circular Letters, 1775–1783. Founders Online, National Archives. https://founders.archives.gov/",
      "rights_status": "public-domain",
      "rights_rationale": "All Washington correspondence and orders are pre-1800 U.S. government and personal papers. Founders Online texts are public-domain transcriptions funded by the National Historical Publications and Records Commission. No copyright restriction applies.",
      "git_tracking": "committed",
      "acquisition_instructions": "Search Founders Online at https://founders.archives.gov/ filtering by author=Washington, document type=General Orders, date range 1775–1783. Select documents with high sacrificial or obligation language density based on a keyword pass for 'sacrifice', 'duty', 'liberty', 'blood', 'glory'. Target 15–25 orders for balanced-core inclusion. Download plain text. Document each selection with the Founders Online document ID in the manifest.",
      "expected_local_path": "cases/am-rev/corpus/raw/am-rev-src-03-washington-general-orders/",
      "analytical_priority": "high",
      "risk_flags": ["multi-document-selection-required", "selection-rationale-must-be-documented"],
      "notes": "Military-order register is important for CMT register-control analysis. Washington's repeated use of sacrifice, duty, and glory language in orders is central to the corpus model. Selection must be documented to support cross-case register comparison."
    }
  ]
}
